Name,City,Price,Rating,Stars,Reviews,Location,Cleanliness,staff,Comfort,Value for Money,Facilities,Wifi,Closest attraction dist,Closest transportation,Closest airport,payment methods,Number of languages,Allowing pets
Hyatt Regency Houston,Houston,752,8.5,4,960,9.1,9.0,8.9,9.0,8.3,8.7,8.1,1.1,350,15,7,1,True
Marriott Marquis Houston,Houston,"1,164",8.4,4,"1,094",9.1,8.9,8.6,8.9,7.8,8.8,6.6,1.5,50,14,7,1,False
"Holiday Inn Express & Suites - Houston - N Downtown, an IHG ",Houston,431,8.8,3,74,8.3,9.1,9.0,9.2,9.0,9.1,6.3,3.1,800,18,6,4,False
"Holiday Inn Houston Downtown, an IHG ",Houston,615,8.5,3,"1,205",8.9,8.9,8.9,8.9,8.3,8.6,8.7,1.4,150,15,5,2,False
" ICON, Autograph Collection",Houston,924,8.6,4,518,9.0,8.9,9.1,8.9,8.1,8.8,8.1,1.7,50,15,7,4,True
Courtyard by Marriott Houston Intercontinental Airport,Houston,512,8.4,3,501,9.0,8.9,8.6,9.0,8.3,8.7,9.2,,14,3.9,6,1,False
"Hilton Garden Inn Houston Medical Center, TX",Houston,586,8.9,3,192,9.1,9.3,9.0,9.2,8.7,9.1,7.5,2.2,1.5,12,8,1,True
"Staybridge Suites - Houston - Galleria Area, an IHG ",Houston,448,8.9,3,195,9.3,9.2,8.9,9.3,8.9,9.2,8.1,3.8,7,21,7,2,True
"Club Quarters  Downton, Houston",Houston,433,7.9,4,"3,678",9.0,8.2,8.7,8.3,8.0,8.0,8.5,1.5,100,15,4,1,True
Hilton Americas - Houston,Houston,829,8.9,4,808,9.4,9.1,9.1,9.2,8.4,9.1,,2.1,400,14,7,10,False
" Indigo Houston at the Galleria, an IHG Hotel",Houston,522,8.3,3,404,9.1,8.8,8.9,8.8,8.4,8.5,8.7,3.6,7,21,7,1,True
The Post Oak ,Houston,"1,762",9.3,5,173,9.5,9.7,9.5,9.7,9.0,9.5,9.3,4,7,21,5,2,True
"Holiday Inn Express & Suites Houston SW - Medical Ctr Area, an IHG ",Houston,471,8.8,3,466,9.0,9.2,8.9,9.3,8.7,9.1,9.0,4.3,1.4,15,6,1,False
Cambria  Houston Downtown Convention Center,Houston,584,8.7,4,"2,115",9.2,9.2,9.0,9.3,8.7,8.9,8.8,1.2,200,15,6,1,False
The Whitehall Houston,Houston,838,8.1,4,489,9.0,8.6,9.0,8.6,8.0,8.2,7.5,1.4,500,15,7,2,True
"Holiday Inn Houston S - NRG Area - Med Ctr, an IHG ",Houston,615,7.4,4,632,8.9,7.8,8.1,7.9,7.4,7.6,7.2,4,700,14,7,2,False
Courtyard by Marriott Houston Medical Center/NRG Park,Houston,461,8.1,3,369,8.8,8.7,8.7,8.6,8.1,8.4,7.9,3.6,850,14,7,1,False
"Holiday Inn Express & Suites Houston South - Near Pearland, an IHG ",Houston,278,8.1,2,167,8.6,8.6,8.3,8.7,8.4,8.2,6.5,11,9,12,7,3,False
Courtyard by Marriott Houston Galleria,Houston,581,8.2,3,814,8.9,8.5,8.7,8.6,8.1,8.3,8.4,5,7,21,7,2,False
La Quinta by Wyndham Houston NW Beltway8/WestRD,Houston,313,8.8,3,384,8.9,9.0,9.1,9.1,8.9,9.0,8.8,15,19,23,4,2,True
La Quinta by Wyndham Houston Channelview,Houston,385,8.8,4,433,8.9,9.2,8.9,9.1,8.8,9.0,8.6,10,16,21,4,1,True
"Holiday Inn Express & Suites Houston Southwest Galleria Area, an IHG ",Houston,345,8.1,3,262,8.5,8.4,8.4,8.6,8.3,8.3,8.5,8,10,24,7,2,False
Days Inn & Suites by Wyndham Houston Hobby Airport,Houston,242,8.3,3,910,8.2,8.8,8.4,8.8,8.6,8.6,8.0,12,9,2.3,4,2,False
Hampton Inn Houston Downtown,Houston,566,8.5,3,658,9.2,8.9,8.9,8.9,8.3,8.6,8.1,1.3,150,15,7,2,True
"Holiday Inn Express & Suites Houston - Hobby Airport Area, an IHG ",Houston,277,7.5,3,319,8.1,8.0,8.2,8.2,7.8,8.0,7.7,11,9,2.6,7,1,False
"The Laura , Houston Downtown, Autograph Collection",Houston,862,8.5,5,492,8.9,8.9,8.9,9.0,8.3,8.8,8.4,1.4,150,15,5,2,True
"Holiday Inn Express & Suites - Houston IAH - Beltway 8, an IHG ",Houston,323,8.1,3,768,8.5,8.7,8.4,8.7,8.4,8.4,8.6,19,12,6,4,4,False
Hyatt Regency Houston Galleria,Houston,727,8.1,4,614,9.2,8.3,8.4,8.5,7.8,8.2,8.8,5,7,21,6,2,False
"Staybridge Suites Houston - IAH Airport, an IHG ",Houston,312,7.8,3,382,8.2,8.2,8.3,8.3,8.1,8.0,7.6,19,12,6,7,2,True
The Westin Oaks Houston at the Galleria,Houston,863,8.5,4,437,9.4,8.9,8.7,9.0,8.1,8.6,,4.5,7,21,7,2,True
Blossom  Houston,Houston,646,9.3,4,808,9.1,9.6,9.4,9.6,9.2,9.5,9.0,2.6,550,13,5,4,True
"Holiday Inn Houston Intercontinental Airport, an IHG ",Houston,322,8.1,3,523,8.8,8.6,8.6,8.6,8.3,8.3,8.6,20,13,5,7,2,False
Embassy Suites Houston - Downtown,Houston,756,8.2,4,704,8.9,8.5,8.8,8.6,7.9,8.4,6.3,1.9,450,15,6,2,True
Residence Inn by Marriott Houston West/Beltway 8 at Clay Road,Houston,477,8.7,3,77,9.0,9.1,9.0,9.1,8.6,8.9,,12,17,27,5,1,True
Residence Inn Houston Northwest / Willowbrook,Houston,357,8.2,3,175,8.8,8.5,8.9,8.4,8.3,8.4,6.7,11,,20,7,2,True
Courtyard Houston I-10 West/Energy Corridor,Houston,306,8.5,3,323,8.8,9.0,9.0,9.0,8.7,8.8,10,15,,35,7,2,False
"Holiday Inn  Houston Westchase, an IHG Hotel",Houston,277,7.9,3,"1,151",8.5,8.3,8.6,8.3,8.0,8.1,8.7,12,15,29,7,2,False
AC  by Marriott Houston Downtown,Houston,631,8.5,4,"1,012",8.8,9.0,8.7,9.1,8.6,8.8,8.8,1.5,30,15,6,1,False
Wyndham Houston near NRG Park - Medical Center,Houston,513,6.5,4,625,8.3,7.3,7.9,7.4,7.1,6.7,7.3,5,650,14,7,4,True
 Zaza Houston Museum District,Houston,"1,061",8.3,4,377,9.2,8.7,8.8,8.8,7.7,8.5,8.9,"1,000",50,14,4,2,True
Comfort Suites near Texas Medical Center - NRG Stadium,Houston,364,8.2,3,258,8.9,8.7,8.4,8.7,8.2,8.3,7.1,3.5,1.1,14,7,2,False
"C. Baldwin, Curio Collection by Hilton",Houston,727,8.1,5,510,8.8,8.8,8.6,8.8,8.0,8.6,,1.3,400,16,10,2,True
Residence Inn Houston Downtown/Convention Center,Houston,522,7.9,3,239,8.7,8.5,8.6,8.5,8.0,8.2,8.8,1.3,150,15,5,1,True
"Home2 Suites by Hilton Houston Medical Center, TX",Houston,510,9.1,3,133,9.3,9.2,9.5,9.2,9.0,9.3,9.4,2.2,1.4,12,8,1,True
Homewood Suites by Hilton Houston Near the Galleria,Houston,471,8.0,4,"1,635",9.2,8.3,8.4,8.4,8.1,8.0,8.5,5,7,21,6,2,True
DoubleTree by Hilton  Houston Greenway Plaza,Houston,344,7.4,4,667,8.2,8.0,8.3,8.1,7.4,7.7,8.4,3.4,3.9,18,7,1,False
Sleep Inn and Suites Downtown Houston,Houston,390,7.3,2,276,8.0,8.1,7.7,8.3,7.8,8.0,8.4,3.5,900,19,4,2,False
Courtyard Houston Downtown Convention Center,Houston,"1,371",7.4,3,190,8.4,8.1,8.1,8.1,7.4,7.6,6.9,1.3,150,15,5,2,False
Super 8 by Wyndham Houston North I-45,Houston,168,6.8,2,416,7.6,7.3,7.6,7.3,7.4,7.2,8.4,,20,9,4,3,False
Courtyard Houston-West University,Houston,495,8.2,3,70,8.9,8.6,8.9,8.8,8.3,8.6,8.8,3.3,3.1,17,6,1,False
"Holiday Inn Express  and Suites Houston East, an IHG Hotel",Houston,383,8.7,2,152,8.8,8.8,9.1,9.0,8.9,8.8,7.5,12,8,15,3,1,False
The Royal Sonesta Houston Galleria,Houston,639,8.2,4,"1,518",9.1,8.6,8.9,8.7,8.0,8.4,8.2,3.9,7,21,9,6,True
Houston Airport Marriott at George Bush Intercontinental,Houston,646,8.1,4,977,9.3,8.8,8.7,8.8,7.3,8.3,7.8,,17,950,7,5,True
Palace Inn Blue Houston East Beltway 8,Houston,263,9.0,0,157,9.1,9.3,8.9,9.4,9.3,9.0,8.5,12,16,23,3,1,False
"Holiday Inn Express & Suites Memorial – CityCentre, an IHG ",Houston,581,8.7,3,843,8.9,9.1,9.0,9.1,8.8,9.0,8.4,11,17,31,5,2,False
"Staybridge Suites - Houston - Medical Center, an IHG ",Houston,461,8.4,1,127,9.1,9.1,8.9,9.1,8.4,8.8,8.8,3.8,1.2,15,4,1,True
"Holiday Inn Houston West Energy Corridor, an IHG ",Houston,337,7.4,3,125,8.6,8.0,7.6,7.9,7.6,7.7,7.5,17,,36,7,1,False
SpringHill Suites Houston Intercontinental Airport,Houston,464,8.6,3,481,9.0,9.0,9.0,9.1,8.6,8.8,6.3,,14,3.9,7,1,False
Embassy Suites by Hilton Houston-Energy Corridor,Houston,669,8.9,4,921,9.2,9.2,9.2,9.2,9.0,9.1,8.5,14,,33,6,1,False
Hampton Inn & Suites Houston-Medical Center-NRG Park,Houston,393,8.0,3,234,8.8,8.5,8.5,8.4,8.0,8.2,8.5,3.1,250,13,6,1,True
SpringHill Suites by Marriott Houston Downtown/Convention Center,Houston,600,7.7,3,432,8.6,8.3,8.4,8.3,7.7,8.1,7.3,1.3,200,15,6,3,False
The Westin Houston Downtown,Houston,"1,061",9.0,4,288,9.5,9.4,9.4,9.5,8.5,9.3,8.5,1.4,250,15,7,2,False
Hyatt Place Houston Galleria,Houston,510,7.7,3,"1,232",9.0,8.2,8.0,8.1,7.6,7.8,8.3,5,7,21,6,2,True
Hyatt House Houston Galleria,Houston,366,7.5,3,794,8.6,7.9,8.3,8.1,7.6,7.7,8.2,4.3,7,21,7,3,True
Howard Johnson by Wyndham Houston Hobby,Houston,124,5.4,2,296,7.0,6.0,6.6,6.0,6.5,5.6,7.4,11,9,1.8,4,1,False
"Magnolia  Houston, a Tribute Portfolio Hotel",Houston,800,8.3,4,145,9.0,8.9,8.9,8.9,8.1,8.7,8.8,950,100,15,6,1,True
La Quinta by Wyndham Houston Bush IAH South,Houston,231,7.3,3,"2,967",8.4,7.5,8.1,7.6,7.9,7.4,8.1,,13,4.6,5,1,True
Best Western Plus Houston Energy Corridor,Houston,204,8.2,3,858,8.7,8.6,8.7,8.7,8.6,8.4,8.5,19,,37,6,2,True
Wingate Houston near NRG Park/Medical Center,Houston,513,6.2,3,723,8.3,6.9,7.8,6.9,6.8,6.2,5.9,5,650,14,6,2,False
Crystal Inn,Houston,263,9.3,4,74,8.6,9.3,9.3,9.4,9.3,9.2,,12,8,14,3,1,False
"Holiday Inn - NW Houston Beltway 8, an IHG ",Houston,291,8.4,3,225,8.6,8.9,8.6,8.8,8.7,8.7,8.8,20,15,15,4,1,False
"Crowne Plaza Houston Galleria Area, an IHG ",Houston,406,7.3,4,877,8.3,7.9,8.1,8.0,7.8,7.6,7.6,5,10,24,4,3,True
TownePlace Suites by Marriott Houston Hobby Airport,Houston,275,8.7,3,328,8.6,9.2,9.0,9.1,9.0,9.0,9.2,11,9,2.7,5,2,True
DoubleTree by Hilton  & Suites Houston by the Galleria,Houston,488,6.9,4,"1,004",8.6,7.7,7.6,7.6,7.1,7.3,6.7,5,7,21,8,2,True
Houston Marriott Medical Center/Museum District,Houston,739,8.3,4,250,9.2,8.8,8.8,8.8,7.8,8.5,,1.7,20,14,7,2,False
La Quinta by Wyndham Houston Hobby Airport,Houston,260,8.1,3,327,8.9,8.5,8.7,8.7,8.5,8.3,8.2,11,8,1.7,4,1,True
Hilton Houston Plaza/Medical Center,Houston,557,8.0,3,603,8.9,8.5,8.6,8.6,8.0,8.2,,1.9,250,14,7,2,False
Embassy Suites by Hilton Houston West - Katy,Houston,695,8.8,4,556,8.9,9.1,8.9,9.0,8.7,9.0,8.2,,,39,7,4,True
Hyatt Place Houston Downtown,Houston,645,8.6,3,557,9.1,9.0,8.8,9.1,8.5,8.7,8.9,950,100,15,6,2,True
"Holiday Inn Express  & Suites Houston North Intercontinental, an IHG Hotel",Houston,286,7.9,2,100,8.5,8.4,8.8,8.4,8.2,7.9,7.5,,17,9,4,2,False
Hilton Garden Inn Houston/Galleria Area,Houston,521,8.4,3,"1,403",9.1,8.8,8.7,8.8,8.4,8.6,8.0,3.7,7,21,9,1,True
The Moran CITYCENTRE,Houston,"1,000",8.5,4,554,9.4,8.8,9.0,8.9,8.1,8.6,,11,17,31,5,1,False
Four Points by Sheraton Houston Intercontinental Airport,Houston,330,8.0,3,564,8.0,8.6,8.5,8.5,8.2,8.2,6.7,19,12,6,7,2,False
The Westin Houston Medical Center,Houston,872,8.9,4,416,9.2,9.4,9.1,9.4,8.7,9.2,,1.7,50,14,6,7,True
Houston Marriott Westchase,Houston,461,7.9,4,372,8.6,8.3,8.3,8.3,8.0,8.1,9.0,10,15,28,6,1,False
"Holiday Inn Express & Suites - Houston Westchase - Westheimer, an IHG ",Houston,319,7.8,3,"1,036",8.6,8.3,8.2,8.3,8.2,8.1,8.2,12,17,31,7,1,False
Best Western Plus Heritage Inn Houston,Houston,303,7.8,3,930,7.9,8.3,8.0,8.3,8.2,8.1,8.1,11,7,15,7,2,False
Residence Inn Houston Westchase On Westheimer,Houston,512,7.2,3,121,8.3,7.8,8.1,8.0,7.5,7.4,8.1,10,14,28,7,1,False
Hyatt Regency Houston West,Houston,521,8.0,4,497,8.6,8.4,8.8,8.3,8.1,8.1,7.2,16,,35,4,2,True
Best Western PLUS Hobby Airport Inn and Suites,Houston,278,8.1,3,993,8.6,8.5,8.5,8.4,8.4,8.2,8.2,11,8,1.8,4,2,True
"The Sam Houston , Curio Collection by Hilton",Houston,669,8.1,4,82,8.5,8.8,8.6,8.7,7.9,8.4,7.5,1.1,200,15,5,2,True
Courtyard Houston Westchase,Houston,333,8.0,3,177,8.7,8.3,8.6,8.6,8.2,8.1,7.9,10,14,28,7,1,False
"Candlewood Suites Houston Medical Center, an IHG ",Houston,371,7.4,3,24,7.8,8.0,8.0,7.9,7.6,6.8,8.8,5,2,15,5,2,True
The Lancaster ,Houston,"1,277",9.4,4,472,9.5,9.7,9.6,9.7,9.1,9.5,9.7,1.3,150,15,4,2,False
Houston Marriott South at Hobby Airport,Houston,616,8.2,3,246,8.7,8.4,8.8,8.5,8.3,8.5,9.1,11,9,2.4,6,2,True
Hampton Inn - Houston/Brookhollow,Houston,307,7.2,3,137,8.2,8.0,8.3,8.1,7.7,7.5,7.8,10,12,22,7,1,True
Hilton Houston Post Oak by the Galleria,Houston,663,7.7,4,396,8.9,8.1,8.3,8.1,7.4,8.0,,4,7,21,6,2,True
Hyatt Place Houston NW Vintage Park,Houston,427,8.9,3,407,9.0,9.3,9.2,9.2,8.9,9.1,8.9,14,,23,6,2,True
 Ylem,Houston,318,8.5,3,653,9.1,8.8,9.1,8.8,8.8,8.7,8.6,3.1,1.2,15,7,2,False
Houston Marriott West Loop by The Galleria,Houston,708,7.1,4,90,8.3,7.8,7.9,7.7,7.0,7.2,6.1,3.5,7,21,7,1,False
"Staybridge Suites Houston - Willowbrook, an IHG ",Houston,299,8.3,3,222,8.6,8.6,8.9,8.5,8.5,8.5,8.7,13,20,21,7,2,True
SpringHill Suites Houston Medical Center / NRG Park,Houston,552,8.7,3,712,9.2,8.9,9.2,9.0,8.7,8.8,8.2,3.7,600,14,7,1,True
Best Western Galleria Inn & Suites,Houston,287,7.7,3,364,8.3,8.0,8.3,8.1,7.9,7.8,7.4,6,9,23,5,3,False
Hampton Inn and Suites Houston Central,Houston,511,8.7,3,309,8.5,9.0,9.0,9.1,8.7,9.0,7.0,2.6,6,21,7,1,False
"Holiday Inn Express & Suites Houston - Memorial Park Area, an IHG ",Houston,371,7.3,3,192,8.2,7.9,8.2,8.0,7.7,7.4,7.5,5,10,24,5,1,True
Sonesta ES Suites Houston Galleria,Houston,506,8.2,3,776,9.3,8.5,8.6,8.5,8.4,8.2,8.1,3.6,7,21,9,2,True
"Holiday Inn Express and Suites Houston North - IAH Area, an IHG ",Houston,291,8.3,3,476,8.5,8.8,8.8,8.8,8.5,8.4,8.1,18,12,9,4,2,False
Home2 Suites Bush Intercontinental Airport Iah Beltway 8,Houston,229,8.5,3,228,8.6,9.0,8.7,9.1,8.7,8.9,8.0,19,12,7,6,1,True
The Westin Galleria Houston,Houston,943,8.4,4,565,9.3,8.7,8.5,8.8,7.9,8.5,,4.7,7,21,7,2,True
Comfort Suites Houston Galleria,Houston,280,7.7,3,435,8.3,8.2,8.7,8.2,8.0,7.9,7.5,5,9,23,7,1,False
Extended Stay America Suites - Houston - Med Ctr - NRG Park - Kirby,Houston,343,7.2,2,350,8.7,7.5,8.4,7.7,7.7,7.3,6.7,4,750,14,6,1,True
Fairfield Inn & Suites Houston Memorial City Area,Houston,398,8.9,3,318,9.0,9.3,9.2,9.3,9.0,9.2,8.8,17,,36,5,3,False
"Staybridge Suites Houston West - Energy Corridor, an IHG ",Houston,450,9.0,3,124,9.3,9.3,9.3,9.3,8.8,9.1,5.0,17,,36,6,1,True
La Quinta by Wyndham Houston Energy Corridor,Houston,264,8.1,3,954,8.5,8.5,8.5,8.4,8.5,8.3,8.2,15,20,33,4,2,True
Best Western Plus JFK Inn and Suites,Houston,447,7.9,3,292,8.7,8.4,8.2,8.5,8.0,8.1,8.4,,13,4.4,7,2,False
Home2 Suites by Hilton Houston Willowbrook,Houston,384,8.5,3,171,9.2,8.7,9.0,8.8,8.5,8.8,8.5,12,,21,7,1,True
"InterContinental Houston Medical Center, an IHG ",Houston,"1,302",9.0,4,630,9.3,9.4,9.3,9.4,8.8,9.2,9.1,2.1,400,14,5,3,True
Home2 Suites by Hilton Houston Energy Corridor,Houston,347,8.7,3,825,9.0,9.0,9.0,9.1,8.9,9.0,7.6,13,19,32,6,2,True
Aloft Houston Downtown,Houston,491,7.5,4,796,8.4,8.1,8.5,8.2,7.6,7.8,8.5,1.5,100,15,5,1,True
Sheraton Houston Brookhollow,Houston,450,7.1,3,144,7.9,7.7,8.3,7.8,7.2,7.3,8.3,6,8,23,7,2,True
Comfort Suites Westchase Houston Energy Corridor,Houston,257,8.0,3,215,8.8,8.3,8.6,8.5,8.4,8.3,8.3,12,17,30,4,2,False
DoubleTree by Hilton Houston Intercontinental Airport,Houston,513,7.6,3,311,8.5,8.3,8.4,8.1,7.7,7.9,10,,13,4.2,6,2,False
"Holiday Inn Houston West - Westway Park, an IHG ",Houston,412,7.7,3,96,8.4,8.2,8.2,8.3,8.1,8.0,,13,18,28,7,2,False
Hilton Garden Inn Houston Energy Corridor,Houston,355,8.3,3,475,8.7,8.7,8.8,8.8,8.4,8.3,8.8,15,,34,9,2,True
"Holiday Inn Express & Suites Houston Northwest-Brookhollow, an IHG ",Houston,294,8.2,3,101,8.5,8.5,8.6,8.5,8.4,8.4,7.0,9,11,22,4,2,False
SpringHill Suites by Marriott Houston Westchase,Houston,388,8.3,3,203,8.8,8.8,8.6,8.8,8.5,8.5,8.1,12,15,28,6,3,False
Homewood Suites by Hilton Houston-Westchase,Houston,435,8.5,3,187,9.1,8.6,9.0,8.7,8.6,8.6,9.1,11,16,29,6,1,False
Hilton Garden Inn Houston Hobby Airport,Houston,464,9.0,3,349,9.2,9.3,9.2,9.3,9.0,9.3,8.8,11,8,1.5,8,2,False
Hilton Garden Inn Houston Westbelt,Houston,253,7.9,3,621,8.6,8.3,8.5,8.3,8.0,8.0,7.5,12,14,28,9,4,True
Hampton Inn Houston I-10 West-Energy Corridor,Houston,289,8.2,3,375,8.8,8.3,9.1,8.4,8.4,8.4,8.6,13,20,33,7,2,True
SureStay Plus  by Best Western Houston Medical Center,Houston,441,7.7,3,"1,993",8.9,8.1,8.3,8.1,8.1,7.7,8.3,2,350,14,7,2,False
"Motel 6 Houston, TX - Medical Center - NRG Stadium",Houston,172,5.7,2,287,7.0,6.6,7.3,6.7,6.8,6.1,5.2,5,2.2,15,4,1,True
Drury Inn & Suites Houston Galleria,Houston,464,8.9,3,499,9.3,9.1,9.5,9.1,8.9,8.9,9.2,3.8,7,21,6,2,True
Embassy Suites by Hilton Houston Near the Galleria,Houston,603,7.2,3,349,9.0,7.7,8.0,7.8,7.4,7.5,7.9,5,7,21,6,1,True
La Quinta by Wyndham Houston Galleria Area,Houston,377,7.1,3,939,8.7,7.3,8.1,7.4,7.4,7.1,7.9,3.8,7,21,5,1,True
SpringHill Suites by Marriott Houston Brookhollow,Houston,352,7.9,3,369,8.6,8.3,8.7,8.4,8.2,8.1,7.9,6,7,23,7,1,False
Ramada by Wyndham Houston Intercontinental Airport South,Houston,175,6.5,3,"1,099",7.7,7.2,7.2,7.2,7.2,6.7,7.5,20,13,4.8,5,2,False
Hilton Houston North,Houston,435,7.9,4,149,8.1,8.6,8.3,8.7,8.0,8.3,,20,13,8,8,1,False
Hampton Inn Houston Hobby Airport,Houston,318,7.3,3,353,8.2,7.7,8.3,7.9,7.7,7.3,5.0,11,8,1.7,7,1,True
Americas Best Value Platinum Inn & Suites,Houston,240,8.0,2,33,8.6,8.1,8.4,8.2,8.4,8.1,,17,11,10,4,1,False
Courtyard Houston NW/290 Corridor,Houston,392,8.4,3,239,8.7,8.6,8.9,8.7,8.4,8.6,8.2,14,16,24,7,1,False
"Hampton Inn & Suites Houston North IAH, TX",Houston,276,7.9,3,236,8.3,8.4,8.7,8.5,8.3,8.3,8.3,19,12,8,8,5,False
TownePlace Suites Houston Northwest,Houston,405,8.2,3,43,9.2,8.5,8.8,8.7,8.5,8.3,7.5,15,,24,7,1,True
Hilton Houston Westchase,Houston,406,7.8,3,220,8.8,8.6,8.5,8.5,8.1,8.1,10,10,15,28,7,3,True
Le Meridien Houston Downtown,Houston,821,8.1,4,210,8.9,8.7,8.6,8.8,8.0,8.5,9.4,1.6,40,15,7,2,True
SpringHill Suites by Marriott Houston I-45 North,Houston,443,8.4,3,147,8.7,8.8,8.7,8.8,8.6,8.6,8.1,,18,9,7,3,True
Aloft Houston by the Galleria,Houston,747,7.7,3,799,9.0,8.1,8.4,8.1,7.7,7.8,7.8,5,8,21,6,2,True
JW Marriott Houston Downtown,Houston,955,8.5,5,578,8.9,9.2,9.1,9.1,8.3,8.9,9.1,1.4,100,15,9,2,True
Hyatt House Houston/Energy Corridor,Houston,284,7.2,3,262,8.3,7.9,8.2,7.8,7.9,7.5,7.8,20,,38,7,2,True
GreenTree  - Houston Hobby Airport,Houston,340,7.9,3,"1,423",8.2,8.3,8.6,8.3,8.2,8.0,8.8,12,9,2.5,7,2,True
The St. Regis Houston,Houston,"1,817",8.5,5,63,9.0,8.8,9.1,8.9,7.7,8.4,6.3,3.1,6,20,5,3,True
 ZaZa Houston Memorial City,Houston,"1,230",9.0,4,372,9.2,9.5,9.2,9.5,8.7,9.3,9.5,11,15,29,5,1,True
Sonesta Simply Suites Houston CityCentre I-10 West,Houston,309,8.2,3,326,9.2,8.5,8.9,8.4,8.6,8.1,8.3,10,17,31,6,1,True
"Holiday Inn Express & Suites Houston - North I45 Spring, an IHG ",Houston,292,8.5,0,395,8.7,9.0,8.8,9.0,8.7,8.8,8.8,,,9,7,2,False
Comfort Suites Northwest Houston At Beltway 8,Houston,368,8.9,3,439,8.8,9.1,9.2,9.2,9.0,9.1,8.2,13,20,22,6,5,False
Quality Inn and Suites NRG Park - Medical Center,Houston,201,5.0,3,377,7.3,5.7,6.9,5.9,5.8,5.2,5.8,5,900,14,4,2,True
Hilton Garden Inn Houston NW America Plaza,Houston,407,7.9,3,212,8.6,8.6,8.3,8.6,8.2,8.5,7.1,15,17,24,5,2,True
"Country Inn & Suites by Radisson, Houston Northwest, TX",Houston,258,7.3,2,619,8.1,7.8,8.3,7.9,7.8,7.6,7.9,19,,28,8,1,True
Wingate by Wyndham Houston Near Bush Intercontinental,Houston,231,7.1,2,25,7.7,7.5,7.8,8.1,8.2,7.3,8.8,19,12,6,4,4,False
Sleep Inn & Suites near Westchase,Houston,225,7.7,3,715,8.3,8.4,8.0,8.2,8.2,8.0,8.7,13,16,30,6,1,True
Fairfield Inn by Marriott Houston Northwest/Willowbrook,Houston,291,8.6,3,186,8.9,9.1,8.5,9.0,8.8,8.9,7.2,13,20,21,7,1,False
 Granduca Houston,Houston,"1,469",8.7,5,126,9.5,9.2,9.0,9.3,7.8,9.0,9.4,4,8,22,5,6,True
Hampton Inn & Suites Houston-Bush Intercontinental Airport,Houston,460,8.3,3,853,9.0,8.8,8.9,8.8,8.5,8.6,8.6,,14,3.9,6,2,False
Extended Stay America Suites - Houston - Galleria - Westheimer,Houston,263,6.9,2,505,8.5,7.0,8.2,7.2,7.3,6.9,7.4,3.9,6,20,6,1,True
Hampton Inn Houston Near the Galleria,Houston,424,7.7,3,644,8.9,7.8,8.2,8.0,7.7,7.6,7.0,3.4,7,21,7,2,True
Courtyard by Marriott Houston I-10 West/Memorial,Houston,405,8.2,3,43,8.5,8.8,8.2,8.5,7.7,8.5,6.9,17,,36,5,1,False
"Hampton Inn & Suites Houston East Beltway 8, Tx",Houston,377,9.5,2,97,9.3,9.6,9.4,9.7,9.3,9.5,,12,16,22,8,1,
Sheraton North Houston at George Bush Intercontinental,Houston,649,7.4,4,458,8.6,8.0,8.2,8.0,7.6,7.7,9.5,,13,4.3,7,2,True
La Quinta by Wyndham Houston - Westchase,Houston,347,7.8,3,593,8.5,8.2,8.4,8.3,8.1,8.0,7.6,12,15,29,4,2,True
Comfort Suites Houston West At Clay Road,Houston,234,7.6,3,231,8.4,8.1,8.3,8.1,8.0,7.9,8.1,13,18,28,7,2,False
Hyatt Place Houston- Northwest/Cy-Fair,Houston,345,8.2,3,380,8.8,8.7,8.6,8.7,8.3,8.6,8.2,20,,29,6,1,True
Americas Best Value Inn & Suites Northeast Houston I-610,Houston,240,8.6,2,135,8.2,9.0,8.5,9.0,8.9,8.8,7.0,9,6,18,3,2,False
La Quinta by Wyndham Houston NW Brookhollow,Houston,260,7.2,3,711,7.9,7.5,8.1,7.6,7.7,7.3,8.1,8,9,23,4,1,True
DoubleTree by Hilton Houston Medical Center  & Suites,Houston,554,7.1,4,"1,055",8.5,7.8,7.7,7.8,7.2,7.4,8.4,2.2,400,14,7,2,True
Hilton Garden Inn Houston/Bush Intercontinental Airport,Houston,468,7.7,3,70,8.5,8.3,8.3,8.4,7.9,8.4,,20,13,4.7,7,1,True
Comfort Inn & Suites Houston I-10 West Energy Corridor,Houston,210,7.3,3,571,8.4,7.6,8.3,7.7,7.7,7.3,7.5,15,,34,6,2,False
Home2 Suites Houston Westchase,Houston,318,8.3,3,255,8.9,8.8,8.7,8.8,8.7,8.6,7.7,12,17,30,5,1,True
Days Inn & Suites by Wyndham Downtown/University of Houston,Houston,219,7.8,3,261,8.1,8.3,8.3,8.4,8.2,8.3,,7,2.6,8,6,2,
Best Western Plus Sam Houston Inn & Suites,Houston,220,7.7,3,169,8.2,7.9,8.5,8.1,8.1,7.9,8.2,13,19,21,8,1,False
Americas Best Value Inn-Near NRG Park/Medical Center,Houston,532,7.5,3,114,8.4,7.8,8.4,7.6,7.8,7.6,7.9,3,1.1,14,4,1,False
Residence Inn Houston West Energy Corridor,Houston,409,8.5,3,17,9.2,8.8,9.3,8.7,8.5,9.0,,17,,36,7,1,True
Palace Inn Blue Tomball Parkway,Houston,232,9.0,2,330,8.7,9.3,9.4,9.3,9.3,9.1,9.3,13,,22,4,4,False
JW Marriott Houston by the Galleria,Houston,893,8.4,4,215,9.3,8.9,8.8,9.0,8.1,8.5,,4.8,7,21,7,1,False
Comfort Suites near Westchase on Beltway 8,Houston,244,7.9,3,744,8.5,8.4,8.3,8.4,8.3,8.1,7.7,13,14,28,8,2,False
SpringHill Suites Houston Hobby Airport,Houston,347,8.5,3,115,8.4,8.8,8.9,8.6,8.7,8.6,8.3,12,9,2.4,7,1,False
Grand Villa Inn Galleria,Houston,235,6.4,2,88,7.5,7.3,7.2,7.0,6.9,6.7,7.5,5,8,22,5,3,False
Super 8 by Wyndham Houston NW Beltway 8,Houston,175,8.5,3,185,8.7,8.8,8.7,8.8,8.7,8.8,10,15,18,22,6,1,True
Best Western Plus Downtown Inn & Suites,Houston,544,8.7,3,330,8.6,9.0,9.1,9.0,8.4,8.9,8.4,2.5,"1,000",16,7,1,False
Home2 Suites At The Galleria,Houston,432,8.7,3,206,9.1,9.0,8.6,9.0,8.6,8.9,8.6,4.1,7,21,5,1,True
DoubleTree by Hilton  Houston Hobby Airport,Houston,461,8.1,3,135,8.7,8.7,8.5,8.7,7.9,8.4,,10,8,1.8,7,1,False
TownePlace Suites Houston Brookhollow,Houston,257,7.7,3,71,8.7,8.5,8.5,8.3,8.1,8.2,8.3,10,12,22,7,1,True
"Crowne Plaza Houston Med Ctr-Galleria Area, an IHG ",Houston,519,6.5,4,189,7.9,7.4,7.7,7.5,6.7,6.8,7.3,3,3,17,7,2,True
"The Chifley Houston, Tapestry Collection by Hilton",Houston,581,7.6,4,301,9.0,7.8,8.1,8.0,7.6,7.5,,4,7,21,9,2,True
Sonesta Simply Suites Houston Galleria Medical Center,Houston,325,7.8,3,640,8.2,8.3,8.5,8.2,8.3,7.9,8.4,4.5,6,20,9,3,True
MainStay Suites Texas Medical Center/Reliant Park,Houston,277,7.7,3,337,8.2,8.2,8.6,8.0,8.2,7.9,,2.9,2.2,12,7,1,False
"Houston, TX Medical Center NRG Stadium",Houston,189,6.8,0,36,7.2,7.4,8.3,7.2,7.2,6.7,,5,2.3,15,4,1,True
"Candlewood Suites Houston I-10 East, an IHG ",Houston,309,8.2,2,235,8.4,8.6,8.8,8.6,8.5,8.4,9.0,13,9,15,7,1,True
"Country Inn & Suites By Radisson, Houston IAH Airport-JFK Boulevard",Houston,239,6.5,2,856,7.9,7.0,7.6,7.1,7.3,6.6,7.3,,13,4.5,5,2,False
"Heights House , Ascend Hotel Collection",Houston,464,8.0,0,496,8.3,8.3,9.0,8.4,8.4,8.1,8.5,4.3,600,20,7,1,True
Fairfield Inn & Suites Houston Hobby Airport,Houston,323,7.7,3,264,8.0,8.2,8.3,8.3,8.0,8.0,7.9,11,8,2.7,7,2,False
Quality Suites Houston Hobby Airport,Houston,269,8.3,2,60,8.8,8.8,9.0,8.9,9.1,8.7,9.2,12,7,1.5,7,1,True
La Quinta by Wyndham Houston Willowbrook,Houston,289,8.4,2,486,8.7,8.7,8.8,8.7,8.5,8.6,8.4,12,,21,3,2,True
Courtyard by Marriott Houston Northeast,Houston,326,8.7,3,40,8.8,9.4,8.9,9.2,8.6,9.1,9.2,,19,14,5,1,False
SpringHill Suites by Marriott Houston Northwest,Houston,398,8.5,3,219,8.8,8.9,8.9,9.1,8.7,8.9,7.7,14,,23,5,1,False
"Holiday Inn Express  & Suites Houston NW Beltway 8-West Road, an IHG Hotel",Houston,323,8.0,2,122,8.5,8.6,8.2,8.5,8.1,8.1,8.1,15,18,23,4,3,False
Baymont by Wyndham Houston/Westchase,Houston,179,6.7,3,945,7.7,7.0,8.2,7.1,7.3,7.0,8.2,11,16,29,6,2,True
TownePlace Suites by Marriott Houston Westchase,Houston,285,8.1,3,153,8.7,8.4,8.6,8.5,8.3,8.3,8.6,12,16,29,7,2,True
TownePlace Suites Houston I-10 East,Houston,309,8.9,3,46,8.6,8.8,9.0,8.8,8.6,8.8,8.8,11,7,15,5,1,True
TownePlace Suites by Marriott Houston Northwest Beltway 8,Houston,282,8.7,3,40,8.9,9.1,9.1,9.1,9.0,9.0,10,14,18,22,4,1,True
Homewood Suites by Hilton Houston NW at Beltway 8,Houston,347,8.2,3,98,8.7,8.5,8.3,8.8,8.5,8.5,7.5,14,,23,6,1,True
Residence Inn Houston by The Galleria,Houston,"1,275",7.8,3,393,9.3,8.0,8.3,8.0,7.8,7.8,7.7,4.6,7,21,7,2,True
Fairfield Inn & Suites Houston Intercontinental Airport,Houston,318,8.4,3,223,8.8,8.9,8.9,8.8,8.5,8.6,9.1,20,13,5,6,1,True
Omni Houston ,Houston,767,8.1,4,162,8.9,8.6,8.8,8.6,7.7,8.3,,4.2,8,22,8,1,True
Comfort Suites Houston IAH Airport - Beltway 8,Houston,244,7.0,3,680,7.7,7.6,7.8,7.6,7.5,7.2,7.6,19,12,6,6,2,True
Hilton Garden Inn Houston Northwest,Houston,393,8.1,3,107,8.7,8.5,8.7,8.6,8.2,8.5,,12,,21,7,1,False
"Holiday Inn Houston SW-Near Sugar Land, an IHG ",Houston,234,5.1,3,606,6.6,6.0,6.8,6.1,5.8,5.6,7.2,15,15,28,6,2,False
TownePlace Suites Houston Intercontinental Airport,Houston,388,8.5,3,40,8.7,8.9,8.8,9.1,8.7,8.7,6.7,20,13,5,6,1,True
Comfort Suites Houston Northwest Cy-Fair,Houston,352,8.7,3,311,9.1,9.1,9.0,9.1,9.1,8.8,8.3,20,,29,5,1,False
"The Westin Houston, Memorial City",Houston,893,8.4,4,156,9.2,8.8,8.7,9.0,7.8,8.8,,12,16,30,6,1,True
Best Western Plus Westheimer - Westchase Inn & Suites,Houston,260,7.4,3,267,8.2,8.1,8.0,8.1,8.0,7.8,7.9,12,17,31,8,1,False
Residence Inn Houston - West University,Houston,464,7.6,3,26,8.4,8.1,8.7,8.3,8.0,7.7,,3.3,3.1,17,7,1,False
Fairfield Inn and Suites by Marriott Houston Brookhollow,Houston,260,8.6,3,78,8.7,9.1,9.0,8.9,8.8,8.9,,9,11,22,5,1,
Courtyard by Marriott Houston Heights/I-10,Houston,959,9.1,3,254,9.4,9.4,9.2,9.5,8.8,9.4,8.8,2.3,2.7,18,9,2,False
Sleep Inn & Suites Highway 290/Northwest Freeway,Houston,230,8.2,3,96,8.8,8.4,8.8,8.6,8.4,8.3,8.6,10,12,22,5,4,False
Baymont by Wyndham Houston Hobby Airport,Houston,190,8.4,3,535,8.7,8.8,8.5,8.9,8.8,8.6,9.0,15,12,4.7,6,1,False
La Colombe d'Or ,Houston,"1,752",9.5,5,41,9.3,9.5,9.5,9.7,8.1,9.5,8.8,1.7,1.3,15,4,1,True
Restwell Inn & Suites I-45 North,Houston,271,7.5,3,522,8.1,8.0,7.8,7.9,8.0,7.7,7.5,,17,9,4,2,False
Best Western Premier Ashton Suites - Willowbrook,Houston,281,8.1,3,278,8.4,8.7,8.3,8.7,8.3,8.5,9.3,11,,20,7,1,False
Courtyard Houston/Brookhollow,Houston,329,8.2,3,158,8.6,8.6,9.0,8.8,8.3,8.3,7.8,5,7,22,7,1,False
